[
  {
    "as_of_utc": "2026-10-27T10:45:56Z",
    "estimate": false,
    "event_id": "401873023",
    "event_type": "game",
    "kickoff_utc": "2026-10-30T00:15Z",
    "locked_utc": "2026-10-27T10:45:56Z",
    "model": "elo_prior",
    "probs": [
      0.6243,
      0.3757
    ],
    "resolved": false
  },
  {
    "as_of_utc": "2026-10-27T10:45:56Z",
    "estimate": false,
    "event_id": "401873026",
    "event_type": "game",
    "kickoff_utc": "2026-11-01T18:00Z",
    "locked_utc": "2026-10-27T10:45:56Z",
    "model": "elo_prior",
    "probs": [
      0.7135,
      0.2865
    ],
    "resolved": false
  },
  {
    "as_of_utc": "2026-10-27T10:45:56Z",
    "estimate": false,
    "event_id": "401873031",
    "event_type": "game",
    "kickoff_utc": "2026-11-01T18:00Z",
    "locked_utc": "2026-10-27T10:45:56Z",
    "model": "elo_prior",
    "probs": [
      0.8071,
      0.1929
    ],
    "resolved": false
  },
  {
    "as_of_utc": "2026-10-27T10:45:56Z",
    "estimate": false,
    "event_id": "401873024",
    "event_type": "game",
    "kickoff_utc": "2026-11-01T18:00Z",
    "locked_utc": "2026-10-27T10:45:56Z",
    "model": "elo_prior",
    "probs": [
      0.6739,
      0.3261
    ],
    "resolved": false
  },
  {
    "as_of_utc": "2026-10-27T10:45:56Z",
    "estimate": false,
    "event_id": "401873030",
    "event_type": "game",
    "kickoff_utc": "2026-11-01T18:00Z",
    "locked_utc": "2026-10-27T10:45:56Z",
    "model": "elo_prior",
    "probs": [
      0.4511,
      0.5489
    ],
    "resolved": false
  },
  {
    "as_of_utc": "2026-10-27T10:45:56Z",
    "estimate": false,
    "event_id": "401873029",
    "event_type": "game",
    "kickoff_utc": "2026-11-01T18:00Z",
    "locked_utc": "2026-10-27T10:45:56Z",
    "model": "elo_prior",
    "probs": [
      0.5176,
      0.4824
    ],
    "resolved": false
  },
  {
    "as_of_utc": "2026-10-27T10:45:56Z",
    "estimate": false,
    "event_id": "401873027",
    "event_type": "game",
    "kickoff_utc": "2026-11-01T18:00Z",
    "locked_utc": "2026-10-27T10:45:56Z",
    "model": "elo_prior",
    "probs": [
      0.6608,
      0.3392
    ],
    "resolved": false
  },
  {
    "as_of_utc": "2026-10-27T10:45:56Z",
    "estimate": false,
    "event_id": "401873025",
    "event_type": "game",
    "kickoff_utc": "2026-11-01T18:00Z",
    "locked_utc": "2026-10-27T10:45:56Z",
    "model": "elo_prior",
    "probs": [
      0.5247,
      0.4753
    ],
    "resolved": false
  },
  {
    "as_of_utc": "2026-10-27T10:45:56Z",
    "estimate": false,
    "event_id": "401873028",
    "event_type": "game",
    "kickoff_utc": "2026-11-01T18:00Z",
    "locked_utc": "2026-10-27T10:45:56Z",
    "model": "elo_prior",
    "probs": [
      0.7819,
      0.2181
    ],
    "resolved": false
  },
  {
    "as_of_utc": "2026-10-27T10:45:56Z",
    "estimate": false,
    "event_id": "401873032",
    "event_type": "game",
    "kickoff_utc": "2026-11-01T21:05Z",
    "locked_utc": "2026-10-27T10:45:56Z",
    "model": "elo_prior",
    "probs": [
      0.753,
      0.247
    ],
    "resolved": false
  },
  {
    "as_of_utc": "2026-10-27T10:45:56Z",
    "estimate": false,
    "event_id": "401873033",
    "event_type": "game",
    "kickoff_utc": "2026-11-01T21:25Z",
    "locked_utc": "2026-10-27T10:45:56Z",
    "model": "elo_prior",
    "probs": [
      0.6446,
      0.3554
    ],
    "resolved": false
  },
  {
    "as_of_utc": "2026-10-27T10:45:56Z",
    "estimate": false,
    "event_id": "401873034",
    "event_type": "game",
    "kickoff_utc": "2026-11-01T21:25Z",
    "locked_utc": "2026-10-27T10:45:56Z",
    "model": "elo_prior",
    "probs": [
      0.299,
      0.701
    ],
    "resolved": false
  },
  {
    "as_of_utc": "2026-10-27T10:45:56Z",
    "estimate": false,
    "event_id": "401873035",
    "event_type": "game",
    "kickoff_utc": "2026-11-02T01:20Z",
    "locked_utc": "2026-10-27T10:45:56Z",
    "model": "elo_prior",
    "probs": [
      0.5315,
      0.4685
    ],
    "resolved": false
  },
  {
    "as_of_utc": "2026-10-27T10:45:56Z",
    "estimate": false,
    "event_id": "401873036",
    "event_type": "game",
    "kickoff_utc": "2026-11-03T01:15Z",
    "locked_utc": "2026-10-27T10:45:56Z",
    "model": "elo_prior",
    "probs": [
      0.6343,
      0.3657
    ],
    "resolved": false
  }
]
