[
  {
    "actual": 0,
    "as_of_utc": "2026-10-20T03:51:08Z",
    "brier": 0.5153155200000001,
    "estimate": false,
    "event_id": "401873010",
    "event_type": "game",
    "kickoff_utc": "2026-10-23T00:15Z",
    "locked_utc": "2026-10-20T03:51:08Z",
    "log_loss": 0.7084638846718386,
    "model": "elo_prior",
    "probs": [
      0.4924,
      0.5076
    ],
    "resolved": true
  },
  {
    "actual": 1,
    "as_of_utc": "2026-10-20T03:51:08Z",
    "brier": 0.357858,
    "estimate": false,
    "event_id": "401873011",
    "event_type": "game",
    "kickoff_utc": "2026-10-25T13:30Z",
    "locked_utc": "2026-10-20T03:51:08Z",
    "log_loss": 0.5499130124740376,
    "model": "elo_prior",
    "probs": [
      0.423,
      0.577
    ],
    "resolved": true
  },
  {
    "actual": 0,
    "as_of_utc": "2026-10-20T03:51:08Z",
    "brier": 0.97329152,
    "estimate": false,
    "event_id": "401873017",
    "event_type": "game",
    "kickoff_utc": "2026-10-25T17:00Z",
    "locked_utc": "2026-10-20T03:51:08Z",
    "log_loss": 1.1960046346767592,
    "model": "elo_prior",
    "probs": [
      0.3024,
      0.6976
    ],
    "resolved": true
  },
  {
    "actual": 1,
    "as_of_utc": "2026-10-20T03:51:08Z",
    "brier": 0.31031442,
    "estimate": false,
    "event_id": "401873013",
    "event_type": "game",
    "kickoff_utc": "2026-10-25T17:00Z",
    "locked_utc": "2026-10-20T03:51:08Z",
    "log_loss": 0.5007102900248978,
    "model": "elo_prior",
    "probs": [
      0.3939,
      0.6061
    ],
    "resolved": true
  },
  {
    "actual": 0,
    "as_of_utc": "2026-10-20T03:51:08Z",
    "brier": 0.10071072000000002,
    "estimate": false,
    "event_id": "401873014",
    "event_type": "game",
    "kickoff_utc": "2026-10-25T17:00Z",
    "locked_utc": "2026-10-20T03:51:08Z",
    "log_loss": 0.2541183556136404,
    "model": "elo_prior",
    "probs": [
      0.7756,
      0.2244
    ],
    "resolved": true
  },
  {
    "actual": 1,
    "as_of_utc": "2026-10-20T03:51:08Z",
    "brier": 0.74078792,
    "estimate": false,
    "event_id": "401873015",
    "event_type": "game",
    "kickoff_utc": "2026-10-25T17:00Z",
    "locked_utc": "2026-10-20T03:51:08Z",
    "log_loss": 0.9380252240201611,
    "model": "elo_prior",
    "probs": [
      0.6086,
      0.3914
    ],
    "resolved": true
  },
  {
    "actual": 1,
    "as_of_utc": "2026-10-20T03:51:08Z",
    "brier": 0.96799698,
    "estimate": false,
    "event_id": "401873018",
    "event_type": "game",
    "kickoff_utc": "2026-10-25T17:00Z",
    "locked_utc": "2026-10-20T03:51:08Z",
    "log_loss": 1.1897412220792116,
    "model": "elo_prior",
    "probs": [
      0.6957,
      0.3043
    ],
    "resolved": true
  },
  {
    "actual": 1,
    "as_of_utc": "2026-10-20T03:51:08Z",
    "brier": 0.72432648,
    "estimate": false,
    "event_id": "401873012",
    "event_type": "game",
    "kickoff_utc": "2026-10-25T17:00Z",
    "locked_utc": "2026-10-20T03:51:08Z",
    "log_loss": 0.9208008873520411,
    "model": "elo_prior",
    "probs": [
      0.6018,
      0.3982
    ],
    "resolved": true
  },
  {
    "actual": 1,
    "as_of_utc": "2026-10-20T03:51:08Z",
    "brier": 0.8991405,
    "estimate": false,
    "event_id": "401873016",
    "event_type": "game",
    "kickoff_utc": "2026-10-25T17:00Z",
    "locked_utc": "2026-10-20T03:51:08Z",
    "log_loss": 1.110178925039575,
    "model": "elo_prior",
    "probs": [
      0.6705,
      0.3295
    ],
    "resolved": true
  },
  {
    "actual": 1,
    "as_of_utc": "2026-10-20T03:51:08Z",
    "brier": 0.19096200000000002,
    "estimate": false,
    "event_id": "401873019",
    "event_type": "game",
    "kickoff_utc": "2026-10-25T20:05Z",
    "locked_utc": "2026-10-20T03:51:08Z",
    "log_loss": 0.3696154552144672,
    "model": "elo_prior",
    "probs": [
      0.309,
      0.691
    ],
    "resolved": true
  },
  {
    "actual": 0,
    "as_of_utc": "2026-10-20T03:51:08Z",
    "brier": 0.37775432,
    "estimate": false,
    "event_id": "401873020",
    "event_type": "game",
    "kickoff_utc": "2026-10-25T20:25Z",
    "locked_utc": "2026-10-20T03:51:08Z",
    "log_loss": 0.570221833722647,
    "model": "elo_prior",
    "probs": [
      0.5654,
      0.4346
    ],
    "resolved": true
  },
  {
    "actual": 1,
    "as_of_utc": "2026-10-20T03:51:08Z",
    "brier": 0.39196657999999995,
    "estimate": false,
    "event_id": "401873021",
    "event_type": "game",
    "kickoff_utc": "2026-10-25T20:25Z",
    "locked_utc": "2026-10-20T03:51:08Z",
    "log_loss": 0.5846515844066463,
    "model": "elo_prior",
    "probs": [
      0.4427,
      0.5573
    ],
    "resolved": true
  },
  {
    "actual": 0,
    "as_of_utc": "2026-10-20T03:51:08Z",
    "brier": 0.29001728000000004,
    "estimate": false,
    "event_id": "401873022",
    "event_type": "game",
    "kickoff_utc": "2026-10-26T00:20Z",
    "locked_utc": "2026-10-20T03:51:08Z",
    "log_loss": 0.47932695670661973,
    "model": "elo_prior",
    "probs": [
      0.6192,
      0.3808
    ],
    "resolved": true
  },
  {
    "as_of_utc": "2026-10-20T03:51:08Z",
    "estimate": false,
    "event_id": "401873009",
    "event_type": "game",
    "kickoff_utc": "2026-10-27T00:15Z",
    "locked_utc": "2026-10-20T03:51:08Z",
    "model": "elo_prior",
    "probs": [
      0.6053,
      0.3947
    ],
    "resolved": false
  }
]
