[
  {
    "actual": 0,
    "as_of_utc": "2026-09-15T03:50:08Z",
    "brier": 0.24123458000000003,
    "estimate": false,
    "event_id": "401872932",
    "event_type": "game",
    "locked_utc": "2026-09-15T03:50:08Z",
    "log_loss": 0.4266376733409654,
    "model": "elo_prior",
    "probs": [
      0.6527,
      0.3473
    ],
    "resolved": true
  },
  {
    "actual": 1,
    "as_of_utc": "2026-09-15T03:50:08Z",
    "brier": 0.7542376199999999,
    "estimate": false,
    "event_id": "401872933",
    "event_type": "game",
    "locked_utc": "2026-09-15T03:50:08Z",
    "log_loss": 0.952177010438564,
    "model": "elo_prior",
    "probs": [
      0.6141,
      0.3859
    ],
    "resolved": true
  },
  {
    "actual": 1,
    "as_of_utc": "2026-09-15T03:50:08Z",
    "brier": 0.67419272,
    "estimate": false,
    "event_id": "401872937",
    "event_type": "game",
    "locked_utc": "2026-09-15T03:50:08Z",
    "log_loss": 0.8689301605143175,
    "model": "elo_prior",
    "probs": [
      0.5806,
      0.4194
    ],
    "resolved": true
  },
  {
    "actual": 1,
    "as_of_utc": "2026-09-15T03:50:08Z",
    "brier": 0.26035328,
    "estimate": false,
    "event_id": "401872939",
    "event_type": "game",
    "locked_utc": "2026-09-15T03:50:08Z",
    "log_loss": 0.44753788453007215,
    "model": "elo_prior",
    "probs": [
      0.3608,
      0.6392
    ],
    "resolved": true
  },
  {
    "actual": 0,
    "as_of_utc": "2026-09-15T03:50:08Z",
    "brier": 0.28743362,
    "estimate": false,
    "event_id": "401872946",
    "event_type": "game",
    "locked_utc": "2026-09-15T03:50:08Z",
    "log_loss": 0.47658524061128993,
    "model": "elo_prior",
    "probs": [
      0.6209,
      0.3791
    ],
    "resolved": true
  },
  {
    "actual": 1,
    "as_of_utc": "2026-09-15T03:50:08Z",
    "brier": 0.48019999999999996,
    "estimate": false,
    "event_id": "401872936",
    "event_type": "game",
    "locked_utc": "2026-09-15T03:50:08Z",
    "log_loss": 0.6733445532637656,
    "model": "elo_prior",
    "probs": [
      0.49,
      0.51
    ],
    "resolved": true
  },
  {
    "actual": 1,
    "as_of_utc": "2026-09-15T03:50:08Z",
    "brier": 0.7023495200000001,
    "estimate": false,
    "event_id": "401872935",
    "event_type": "game",
    "locked_utc": "2026-09-15T03:50:08Z",
    "log_loss": 0.8979597751894316,
    "model": "elo_prior",
    "probs": [
      0.5926,
      0.4074
    ],
    "resolved": true
  },
  {
    "actual": 1,
    "as_of_utc": "2026-09-15T03:50:08Z",
    "brier": 0.8871119999999999,
    "estimate": false,
    "event_id": "401872938",
    "event_type": "game",
    "locked_utc": "2026-09-15T03:50:08Z",
    "log_loss": 1.0966142860054366,
    "model": "elo_prior",
    "probs": [
      0.666,
      0.334
    ],
    "resolved": true
  },
  {
    "actual": 1,
    "as_of_utc": "2026-09-15T03:50:08Z",
    "brier": 0.8738420000000001,
    "estimate": false,
    "event_id": "401872934",
    "event_type": "game",
    "locked_utc": "2026-09-15T03:50:08Z",
    "log_loss": 1.0817551716016867,
    "model": "elo_prior",
    "probs": [
      0.661,
      0.339
    ],
    "resolved": true
  },
  {
    "actual": 0,
    "as_of_utc": "2026-09-15T03:50:08Z",
    "brier": 0.5360265800000001,
    "estimate": false,
    "event_id": "401872940",
    "event_type": "game",
    "locked_utc": "2026-09-15T03:50:08Z",
    "log_loss": 0.7291889519072109,
    "model": "elo_prior",
    "probs": [
      0.4823,
      0.5177
    ],
    "resolved": true
  },
  {
    "actual": 1,
    "as_of_utc": "2026-09-15T03:50:08Z",
    "brier": 0.84682098,
    "estimate": false,
    "event_id": "401872941",
    "event_type": "game",
    "locked_utc": "2026-09-15T03:50:08Z",
    "log_loss": 1.0518241271693507,
    "model": "elo_prior",
    "probs": [
      0.6507,
      0.3493
    ],
    "resolved": true
  },
  {
    "as_of_utc": "2026-09-15T03:50:08Z",
    "estimate": false,
    "event_id": "401872944",
    "event_type": "game",
    "locked_utc": "2026-09-15T03:50:08Z",
    "model": "elo_prior",
    "probs": [
      0.5669,
      0.4331
    ],
    "resolved": false
  },
  {
    "as_of_utc": "2026-09-15T03:50:08Z",
    "estimate": false,
    "event_id": "401872943",
    "event_type": "game",
    "locked_utc": "2026-09-15T03:50:08Z",
    "model": "elo_prior",
    "probs": [
      0.3337,
      0.6663
    ],
    "resolved": false
  },
  {
    "actual": 0,
    "as_of_utc": "2026-09-15T03:50:08Z",
    "brier": 0.11026208000000001,
    "estimate": false,
    "event_id": "401872942",
    "event_type": "game",
    "locked_utc": "2026-09-15T03:50:08Z",
    "log_loss": 0.26761804141603923,
    "model": "elo_prior",
    "probs": [
      0.7652,
      0.2348
    ],
    "resolved": true
  },
  {
    "as_of_utc": "2026-09-15T03:50:08Z",
    "estimate": false,
    "event_id": "401872945",
    "event_type": "game",
    "locked_utc": "2026-09-15T03:50:08Z",
    "model": "elo_prior",
    "probs": [
      0.633,
      0.367
    ],
    "resolved": false
  },
  {
    "as_of_utc": "2026-09-15T03:50:08Z",
    "estimate": false,
    "event_id": "401872947",
    "event_type": "game",
    "locked_utc": "2026-09-15T03:50:08Z",
    "model": "elo_prior",
    "probs": [
      0.6593,
      0.3407
    ],
    "resolved": false
  }
]
